{
  "schemaVersion": "4.0",
  "name": "VFX_Abyss_BurnTick_Burst",
  "description": "기존 Ember/Flame Sprite를 3D Sphere/Shard와 Turbulence로 교체",
  "buildMode": "NodeGraph3D",
  "requiredCapabilities": [
    "MeshOutput",
    "NodeExpressions",
    "Procedural3D",
    "TextureFree"
  ],
  "systems": [
    {
      "name": "EmberCore",
      "spawnMode": "Burst",
      "capacity": 1024,
      "spawnCount": 54,
      "spawnRate": 20,
      "lifetime": {
        "min": 0.25,
        "max": 0.75
      },
      "size": {
        "min": 0.025,
        "max": 0.09
      },
      "positionMode": "Box",
      "spawnBoxExtents": {
        "x": 0.06,
        "y": 0.06,
        "z": 0.06
      },
      "velocityMode": "Radial",
      "direction": {
        "x": 0,
        "y": 1,
        "z": 0
      },
      "speed": {
        "min": 0.8,
        "max": 3.2
      },
      "spread": 0.25,
      "gravity": {
        "x": 0,
        "y": 0.9,
        "z": 0
      },
      "drag": 0.35,
      "turbulenceEnabled": true,
      "turbulenceIntensity": 1.0,
      "turbulenceFrequency": 1.4,
      "turbulenceDrag": 0.15,
      "turbulenceOctaves": 3,
      "turbulenceRoughness": 0.5,
      "turbulenceLacunarity": 2.0,
      "startColor": {
        "r": 1,
        "g": 0.12,
        "b": 0.01,
        "a": 1
      },
      "blendMode": "Additive",
      "outputMode": "Mesh",
      "proceduralMesh": "Sphere",
      "meshAssetPath": "",
      "meshSubAssetName": "",
      "torusMajorRadius": 0.5,
      "torusMinorRadius": 0.08,
      "torusRadialSegments": 48,
      "torusTubeSegments": 12,
      "shaderGraphAssetPath": "",
      "orientationMode": "OrientToVelocity",
      "orientToVelocity": true,
      "velocityExpression": {
        "kind": "Multiply",
        "valueType": "Vector3",
        "inputs": [
          {
            "kind": "Normalize",
            "valueType": "Vector3",
            "inputs": [
              {
                "kind": "RandomVector3",
                "valueType": "Vector3",
                "vectorMin": {
                  "x": -1,
                  "y": -1,
                  "z": -1
                },
                "vectorMax": {
                  "x": 1,
                  "y": 1,
                  "z": 1
                }
              }
            ]
          },
          {
            "kind": "RandomFloat",
            "valueType": "Float",
            "floatRange": {
              "min": 0.8,
              "max": 3.2
            }
          }
        ]
      },
      "customBlocks": [],
      "textureAssetPath": "",
      "materialAssetPath": "",
      "useFlipbook": false,
      "flipbookColumns": 1,
      "flipbookRows": 1,
      "flipbookBlend": false,
      "capabilities": [
        "MeshOutput",
        "NodeExpressions"
      ]
    },
    {
      "name": "FlameFragments",
      "spawnMode": "Burst",
      "capacity": 1024,
      "spawnCount": 32,
      "spawnRate": 20,
      "lifetime": {
        "min": 0.35,
        "max": 0.95
      },
      "size": {
        "min": 0.04,
        "max": 0.16
      },
      "positionMode": "Box",
      "spawnBoxExtents": {
        "x": 0.06,
        "y": 0.06,
        "z": 0.06
      },
      "velocityMode": "Radial",
      "direction": {
        "x": 0,
        "y": 1,
        "z": 0
      },
      "speed": {
        "min": 0.5,
        "max": 2.2
      },
      "spread": 0.25,
      "gravity": {
        "x": 0,
        "y": 1.4,
        "z": 0
      },
      "drag": 0.45,
      "turbulenceEnabled": true,
      "turbulenceIntensity": 1.0,
      "turbulenceFrequency": 1.4,
      "turbulenceDrag": 0.15,
      "turbulenceOctaves": 3,
      "turbulenceRoughness": 0.5,
      "turbulenceLacunarity": 2.0,
      "startColor": {
        "r": 1,
        "g": 0.32,
        "b": 0.015,
        "a": 0.9
      },
      "blendMode": "Additive",
      "outputMode": "Mesh",
      "proceduralMesh": "Shard",
      "meshAssetPath": "",
      "meshSubAssetName": "",
      "torusMajorRadius": 0.5,
      "torusMinorRadius": 0.08,
      "torusRadialSegments": 48,
      "torusTubeSegments": 12,
      "shaderGraphAssetPath": "",
      "orientationMode": "OrientToVelocity",
      "orientToVelocity": true,
      "velocityExpression": {
        "kind": "Multiply",
        "valueType": "Vector3",
        "inputs": [
          {
            "kind": "Normalize",
            "valueType": "Vector3",
            "inputs": [
              {
                "kind": "RandomVector3",
                "valueType": "Vector3",
                "vectorMin": {
                  "x": -1,
                  "y": -1,
                  "z": -1
                },
                "vectorMax": {
                  "x": 1,
                  "y": 1,
                  "z": 1
                }
              }
            ]
          },
          {
            "kind": "RandomFloat",
            "valueType": "Float",
            "floatRange": {
              "min": 0.5,
              "max": 2.2
            }
          }
        ]
      },
      "customBlocks": [],
      "textureAssetPath": "",
      "materialAssetPath": "",
      "useFlipbook": false,
      "flipbookColumns": 1,
      "flipbookRows": 1,
      "flipbookBlend": false,
      "capabilities": [
        "MeshOutput",
        "NodeExpressions"
      ]
    }
  ],
  "exposedOverrides": []
}
