{
  "schemaVersion": "4.0",
  "name": "VFX_Abyss_Bleeding_Status",
  "description": "기존 Blood Drop Sprite loop를 3D Sphere Mesh로 교체",
  "buildMode": "NodeGraph3D",
  "requiredCapabilities": [
    "MeshOutput",
    "NodeExpressions",
    "Procedural3D",
    "TextureFree"
  ],
  "systems": [
    {
      "name": "SeepingDrops",
      "spawnMode": "Rate",
      "capacity": 1024,
      "spawnCount": 10,
      "spawnRate": 14,
      "lifetime": {
        "min": 0.7,
        "max": 1.5
      },
      "size": {
        "min": 0.025,
        "max": 0.075
      },
      "positionMode": "Box",
      "spawnBoxExtents": {
        "x": 0.06,
        "y": 0.06,
        "z": 0.06
      },
      "velocityMode": "Directional",
      "direction": {
        "x": 0,
        "y": -1,
        "z": 0
      },
      "speed": {
        "min": 0.05,
        "max": 0.45
      },
      "spread": 0.18,
      "gravity": {
        "x": 0,
        "y": -2.2,
        "z": 0
      },
      "drag": 0.3,
      "turbulenceEnabled": false,
      "turbulenceIntensity": 1.0,
      "turbulenceFrequency": 1.4,
      "turbulenceDrag": 0.15,
      "turbulenceOctaves": 3,
      "turbulenceRoughness": 0.5,
      "turbulenceLacunarity": 2.0,
      "startColor": {
        "r": 0.5,
        "g": 0.005,
        "b": 0.01,
        "a": 0.9
      },
      "blendMode": "Additive",
      "outputMode": "Mesh",
      "proceduralMesh": "Sphere",
      "meshAssetPath": "",
      "meshSubAssetName": "",
      "torusMajorRadius": 0.5,
      "torusMinorRadius": 0.08,
      "torusRadialSegments": 48,
      "torusTubeSegments": 12,
      "shaderGraphAssetPath": "",
      "orientationMode": "OrientToVelocity",
      "orientToVelocity": true,
      "customBlocks": [],
      "textureAssetPath": "",
      "materialAssetPath": "",
      "useFlipbook": false,
      "flipbookColumns": 1,
      "flipbookRows": 1,
      "flipbookBlend": false,
      "capabilities": [
        "MeshOutput",
        "NodeExpressions"
      ]
    }
  ],
  "exposedOverrides": []
}
