{
  "schemaVersion": "4.0",
  "name": "VFX_Abyss_DarkRed_SwordWave",
  "description": "기존 Slash Arc Texture를 extruded ArcBlade Mesh로 교체",
  "buildMode": "NodeGraph3D",
  "requiredCapabilities": [
    "MeshOutput",
    "NodeExpressions",
    "Procedural3D",
    "TextureFree"
  ],
  "systems": [
    {
      "name": "SwordArc",
      "spawnMode": "Burst",
      "capacity": 1024,
      "spawnCount": 1,
      "spawnRate": 20,
      "lifetime": {
        "min": 0.32,
        "max": 0.32
      },
      "size": {
        "min": 0.9,
        "max": 0.9
      },
      "positionMode": "Point",
      "spawnBoxExtents": {
        "x": 0,
        "y": 0,
        "z": 0
      },
      "velocityMode": "None",
      "direction": {
        "x": 0,
        "y": 1,
        "z": 0
      },
      "speed": {
        "min": 0,
        "max": 0
      },
      "spread": 0.25,
      "gravity": {
        "x": 0,
        "y": 0,
        "z": 0
      },
      "drag": 0,
      "turbulenceEnabled": false,
      "turbulenceIntensity": 1.0,
      "turbulenceFrequency": 1.4,
      "turbulenceDrag": 0.15,
      "turbulenceOctaves": 3,
      "turbulenceRoughness": 0.5,
      "turbulenceLacunarity": 2.0,
      "startColor": {
        "r": 0.32,
        "g": 0.0,
        "b": 0.03,
        "a": 0.95
      },
      "blendMode": "Additive",
      "outputMode": "Mesh",
      "proceduralMesh": "ArcBlade",
      "meshAssetPath": "",
      "meshSubAssetName": "",
      "torusMajorRadius": 0.5,
      "torusMinorRadius": 0.08,
      "torusRadialSegments": 48,
      "torusTubeSegments": 12,
      "shaderGraphAssetPath": "",
      "orientationMode": "FixedAxis",
      "orientToVelocity": false,
      "customBlocks": [],
      "textureAssetPath": "",
      "materialAssetPath": "",
      "useFlipbook": false,
      "flipbookColumns": 1,
      "flipbookRows": 1,
      "flipbookBlend": false,
      "capabilities": [
        "MeshOutput",
        "NodeExpressions"
      ],
      "sizeExpression": {
        "kind": "Add",
        "valueType": "Float",
        "inputs": [
          {
            "kind": "LiteralFloat",
            "valueType": "Float",
            "floatValue": 0.9
          },
          {
            "kind": "Multiply",
            "valueType": "Float",
            "inputs": [
              {
                "kind": "Sin",
                "valueType": "Float",
                "inputs": [
                  {
                    "kind": "Time",
                    "valueType": "Float"
                  }
                ]
              },
              {
                "kind": "LiteralFloat",
                "valueType": "Float",
                "floatValue": 0.08
              }
            ]
          }
        ]
      }
    },
    {
      "name": "ArcShards",
      "spawnMode": "Burst",
      "capacity": 1024,
      "spawnCount": 28,
      "spawnRate": 20,
      "lifetime": {
        "min": 0.22,
        "max": 0.6
      },
      "size": {
        "min": 0.025,
        "max": 0.09
      },
      "positionMode": "Box",
      "spawnBoxExtents": {
        "x": 0.06,
        "y": 0.06,
        "z": 0.06
      },
      "velocityMode": "Radial",
      "direction": {
        "x": 0,
        "y": 1,
        "z": 0
      },
      "speed": {
        "min": 1.2,
        "max": 4.2
      },
      "spread": 0.25,
      "gravity": {
        "x": 0,
        "y": -1,
        "z": 0
      },
      "drag": 0.65,
      "turbulenceEnabled": false,
      "turbulenceIntensity": 1.0,
      "turbulenceFrequency": 1.4,
      "turbulenceDrag": 0.15,
      "turbulenceOctaves": 3,
      "turbulenceRoughness": 0.5,
      "turbulenceLacunarity": 2.0,
      "startColor": {
        "r": 0.55,
        "g": 0.01,
        "b": 0.025,
        "a": 0.8
      },
      "blendMode": "Additive",
      "outputMode": "Mesh",
      "proceduralMesh": "Shard",
      "meshAssetPath": "",
      "meshSubAssetName": "",
      "torusMajorRadius": 0.5,
      "torusMinorRadius": 0.08,
      "torusRadialSegments": 48,
      "torusTubeSegments": 12,
      "shaderGraphAssetPath": "",
      "orientationMode": "OrientToVelocity",
      "orientToVelocity": true,
      "velocityExpression": {
        "kind": "Multiply",
        "valueType": "Vector3",
        "inputs": [
          {
            "kind": "Normalize",
            "valueType": "Vector3",
            "inputs": [
              {
                "kind": "RandomVector3",
                "valueType": "Vector3",
                "vectorMin": {
                  "x": -1,
                  "y": -1,
                  "z": -1
                },
                "vectorMax": {
                  "x": 1,
                  "y": 1,
                  "z": 1
                }
              }
            ]
          },
          {
            "kind": "RandomFloat",
            "valueType": "Float",
            "floatRange": {
              "min": 1.2,
              "max": 4.2
            }
          }
        ]
      },
      "customBlocks": [],
      "textureAssetPath": "",
      "materialAssetPath": "",
      "useFlipbook": false,
      "flipbookColumns": 1,
      "flipbookRows": 1,
      "flipbookBlend": false,
      "capabilities": [
        "MeshOutput",
        "NodeExpressions"
      ]
    }
  ],
  "exposedOverrides": []
}
