{
  "schemaVersion": "4.0",
  "name": "VFX_NodeGraph3D_Sphere_Math",
  "description": "Texture 없이 Sphere Mesh와 Add/Multiply/Normalize/Random/Sin Operator를 검증하는 최소 Recipe",
  "buildMode": "NodeGraph3D",
  "requiredCapabilities": ["MeshOutput", "NodeExpressions", "Procedural3D", "TextureFree"],
  "systems": [
    {
      "name": "MathSphere",
      "spawnMode": "Burst",
      "capacity": 512,
      "spawnCount": 48,
      "spawnRate": 10,
      "lifetime": { "min": 0.4, "max": 0.9 },
      "size": { "min": 0.04, "max": 0.1 },
      "positionMode": "Point",
      "spawnBoxExtents": { "x": 0, "y": 0, "z": 0 },
      "velocityMode": "Radial",
      "direction": { "x": 0, "y": 1, "z": 0 },
      "speed": { "min": 1.5, "max": 4.5 },
      "spread": 0.2,
      "gravity": { "x": 0, "y": -2.5, "z": 0 },
      "drag": 0.35,
      "turbulenceEnabled": false,
      "turbulenceIntensity": 1,
      "turbulenceFrequency": 1,
      "turbulenceDrag": 0.2,
      "turbulenceOctaves": 3,
      "turbulenceRoughness": 0.5,
      "turbulenceLacunarity": 2,
      "startColor": { "r": 0.7, "g": 0.02, "b": 0.06, "a": 1 },
      "blendMode": "Additive",
      "outputMode": "Mesh",
      "proceduralMesh": "Sphere",
      "meshAssetPath": "",
      "meshSubAssetName": "",
      "torusMajorRadius": 0.5,
      "torusMinorRadius": 0.08,
      "torusRadialSegments": 48,
      "torusTubeSegments": 12,
      "shaderGraphAssetPath": "",
      "orientationMode": "FixedAxis",
      "orientToVelocity": false,
      "velocityExpression": {
        "kind": "Multiply",
        "valueType": "Vector3",
        "inputs": [
          { "kind": "Normalize", "valueType": "Vector3", "inputs": [{ "kind": "RandomVector3", "valueType": "Vector3", "vectorMin": { "x": -1, "y": -1, "z": -1 }, "vectorMax": { "x": 1, "y": 1, "z": 1 } }] },
          { "kind": "RandomFloat", "valueType": "Float", "floatRange": { "min": 1.5, "max": 4.5 } }
        ]
      },
      "customBlocks": [],
      "textureAssetPath": "",
      "materialAssetPath": "",
      "useFlipbook": false,
      "flipbookColumns": 1,
      "flipbookRows": 1,
      "flipbookBlend": false,
      "capabilities": ["MeshOutput", "NodeExpressions"]
    }
  ],
  "exposedOverrides": []
}
